{
  "schema_version": "1.0.0",
  "analysis_id": "MYE_ANA_000023",
  "image_id": "MYE_IMG_000006",
  "image_sha256": "77392a7043a48cae6df334bdba32ce6be4e5ad2f9bda21ce5f7d39ef8711269a",
  "analysis_version": 2,
  "analyzed_at": "2026-08-10T06:03:16.295Z",
  "blind_analysis": true,
  "label_visible_during_analysis": false,
  "human_decision_context_used": false,
  "data_classification": "REAL_AI_ANALYSIS",
  "analyzer": {
    "provider": "OpenAI",
    "model": "Codex multimodal runtime",
    "analyzer_version": "session-2026-08-10",
    "analysis_prompt_version": "my-eyes-blind-visual-observation-v1"
  },
  "overall_observation_summary": "Landscape red technology banner with a young man on the right extending both arms, wearing a green party hat, with floating cards behind and empty dark space on the left.",
  "dimensions": {
    "format_usage": {
      "status": "OBSERVED",
      "summary": "Wide frame reserves the left side as dark open space and places the gesturing figure on the right.",
      "facts": [
        {
          "fact_id": "FACT_001",
          "attribute": "format_usage",
          "observation": "Wide frame reserves the left side as dark open space and places the gesturing figure on the right.",
          "confidence": "HIGH"
        }
      ]
    },
    "composition": {
      "status": "OBSERVED",
      "summary": "The subject extends hands toward both edges, with the body centered in the occupied right region.",
      "facts": [
        {
          "fact_id": "FACT_002",
          "attribute": "composition",
          "observation": "The subject extends hands toward both edges, with the body centered in the occupied right region.",
          "confidence": "HIGH"
        }
      ]
    },
    "visual_hierarchy": {
      "status": "OBSERVED",
      "summary": "The face and outstretched hands lead against the red interface backdrop.",
      "facts": [
        {
          "fact_id": "FACT_003",
          "attribute": "visual_hierarchy",
          "observation": "The face and outstretched hands lead against the red interface backdrop.",
          "confidence": "HIGH"
        }
      ]
    },
    "depth": {
      "status": "OBSERVED",
      "summary": "Cropped hands occupy the near plane, the subject sits mid-plane and floating panels recede behind.",
      "facts": [
        {
          "fact_id": "FACT_004",
          "attribute": "depth",
          "observation": "Cropped hands occupy the near plane, the subject sits mid-plane and floating panels recede behind.",
          "confidence": "HIGH"
        }
      ]
    },
    "subject_environment_integration": {
      "status": "OBSERVED",
      "summary": "Red rim light and interface reflections visually place the subject inside the warning-style setting.",
      "facts": [
        {
          "fact_id": "FACT_005",
          "attribute": "subject_environment_integration",
          "observation": "Red rim light and interface reflections visually place the subject inside the warning-style setting.",
          "confidence": "HIGH"
        }
      ]
    },
    "lighting": {
      "status": "OBSERVED",
      "summary": "Red ambient and rim illumination dominates, with neutral frontal light on the face.",
      "facts": [
        {
          "fact_id": "FACT_006",
          "attribute": "lighting",
          "observation": "Red ambient and rim illumination dominates, with neutral frontal light on the face.",
          "confidence": "HIGH"
        }
      ]
    },
    "color": {
      "status": "OBSERVED",
      "summary": "Dark red, black and skin tones dominate, with a small green hat accent.",
      "facts": [
        {
          "fact_id": "FACT_007",
          "attribute": "color",
          "observation": "Dark red, black and skin tones dominate, with a small green hat accent.",
          "confidence": "HIGH"
        }
      ]
    },
    "typography": {
      "status": "NOT_PRESENT",
      "summary": "No legible typography is present in the observed frame.",
      "facts": []
    },
    "environment": {
      "status": "OBSERVED",
      "summary": "An abstract red technology or warning interface contains floating thumbnail panels.",
      "facts": [
        {
          "fact_id": "FACT_008",
          "attribute": "environment",
          "observation": "An abstract red technology or warning interface contains floating thumbnail panels.",
          "confidence": "HIGH"
        }
      ]
    },
    "foreground": {
      "status": "OBSERVED",
      "summary": "Both hands extend close to and are cropped by the lateral frame edges.",
      "facts": [
        {
          "fact_id": "FACT_009",
          "attribute": "foreground",
          "observation": "Both hands extend close to and are cropped by the lateral frame edges.",
          "confidence": "HIGH"
        }
      ]
    },
    "effects": {
      "status": "OBSERVED",
      "summary": "Red glow, particles, fine interface lines and suspended cards are visibly layered.",
      "facts": [
        {
          "fact_id": "FACT_010",
          "attribute": "effects",
          "observation": "Red glow, particles, fine interface lines and suspended cards are visibly layered.",
          "confidence": "HIGH"
        }
      ]
    },
    "realism_coherence": {
      "status": "OBSERVED",
      "summary": "A photographic person is combined with nonphysical interface panels and a playful party-hat prop.",
      "facts": [
        {
          "fact_id": "FACT_011",
          "attribute": "realism_coherence",
          "observation": "A photographic person is combined with nonphysical interface panels and a playful party-hat prop.",
          "confidence": "HIGH"
        }
      ]
    },
    "complexity_density": {
      "status": "OBSERVED",
      "summary": "Moderate detail clusters on the right while the left field remains visually sparse.",
      "facts": [
        {
          "fact_id": "FACT_012",
          "attribute": "complexity_density",
          "observation": "Moderate detail clusters on the right while the left field remains visually sparse.",
          "confidence": "HIGH"
        }
      ]
    },
    "distinctive_design_decisions": {
      "status": "OBSERVED",
      "summary": "Wide open arms and a small green party hat contrast with the red warning-interface environment.",
      "facts": [
        {
          "fact_id": "FACT_013",
          "attribute": "distinctive_design_decisions",
          "observation": "Wide open arms and a small green party hat contrast with the red warning-interface environment.",
          "confidence": "HIGH"
        }
      ]
    }
  },
  "interpretations": [],
  "uncertainty_notes": [
    "Observation was performed from a neutral compressed visual rendition derived from the indexed image bytes; very small text and fine details may be uncertain.",
    "Version 2 removes intent-implying wording from an otherwise unchanged blind observation."
  ],
  "semantic_boundaries": {
    "human_reason_written": false,
    "general_quality_judgment_performed": false,
    "designer_preference_inferred": false,
    "pairwise_inference_performed": false
  },
  "provenance": {
    "asserted_by": "MULTIMODAL_ANALYZER",
    "recorded_by": "APPROVED_DIRECTION_MEMORY_SERVICE",
    "source_type": "IMAGE_BYTES",
    "source_ref": "my-eyes-image://MYE_IMG_000006@sha256:77392a7043a48cae6df334bdba32ce6be4e5ad2f9bda21ce5f7d39ef8711269a",
    "recorded_at": "2026-08-10T06:03:16.295Z",
    "data_classification": "REAL_AI_ANALYSIS"
  }
}
