{
  "schema_version": "1.0.0",
  "analysis_id": "MYE_ANA_000018",
  "image_id": "MYE_IMG_000004",
  "image_sha256": "62ca8e94715864da42ae76067ebbc644f34b4d39f4b510416f6062643d3f9dce",
  "analysis_version": 1,
  "analyzed_at": "2026-08-10T05:58:45.868Z",
  "blind_analysis": true,
  "label_visible_during_analysis": false,
  "human_decision_context_used": false,
  "data_classification": "REAL_AI_ANALYSIS",
  "analyzer": {
    "provider": "OpenAI",
    "model": "Codex multimodal runtime",
    "analyzer_version": "session-2026-08-10",
    "analysis_prompt_version": "my-eyes-blind-visual-observation-v1"
  },
  "overall_observation_summary": "Portrait event poster with a centered bearded man in black, dark green background, neon circular arc, flowing wave graphics and event details below.",
  "dimensions": {
    "format_usage": {
      "status": "OBSERVED",
      "summary": "Portrait layout aligns portrait, method title, subtitle and event information down the center.",
      "facts": [
        {
          "fact_id": "FACT_001",
          "attribute": "format_usage",
          "observation": "Portrait layout aligns portrait, method title, subtitle and event information down the center.",
          "confidence": "HIGH"
        }
      ]
    },
    "composition": {
      "status": "OBSERVED",
      "summary": "The subject is centered symmetrically inside a circular light arc and layered wave forms.",
      "facts": [
        {
          "fact_id": "FACT_002",
          "attribute": "composition",
          "observation": "The subject is centered symmetrically inside a circular light arc and layered wave forms.",
          "confidence": "HIGH"
        }
      ]
    },
    "visual_hierarchy": {
      "status": "OBSERVED",
      "summary": "The face leads, followed by the title across the chest and smaller date-location details.",
      "facts": [
        {
          "fact_id": "FACT_003",
          "attribute": "visual_hierarchy",
          "observation": "The face leads, followed by the title across the chest and smaller date-location details.",
          "confidence": "HIGH"
        }
      ]
    },
    "depth": {
      "status": "OBSERVED",
      "summary": "Front wave ribbons, subject, circular arc and dark background establish several controlled planes.",
      "facts": [
        {
          "fact_id": "FACT_004",
          "attribute": "depth",
          "observation": "Front wave ribbons, subject, circular arc and dark background establish several controlled planes.",
          "confidence": "HIGH"
        }
      ]
    },
    "subject_environment_integration": {
      "status": "OBSERVED",
      "summary": "Green edge light and encircling graphics connect the subject to the abstract backdrop.",
      "facts": [
        {
          "fact_id": "FACT_005",
          "attribute": "subject_environment_integration",
          "observation": "Green edge light and encircling graphics connect the subject to the abstract backdrop.",
          "confidence": "HIGH"
        }
      ]
    },
    "lighting": {
      "status": "OBSERVED",
      "summary": "A green circular backlight and restrained frontal portrait light define the figure.",
      "facts": [
        {
          "fact_id": "FACT_006",
          "attribute": "lighting",
          "observation": "A green circular backlight and restrained frontal portrait light define the figure.",
          "confidence": "HIGH"
        }
      ]
    },
    "color": {
      "status": "OBSERVED",
      "summary": "Black and deep forest green dominate with luminous emerald and white text accents.",
      "facts": [
        {
          "fact_id": "FACT_007",
          "attribute": "color",
          "observation": "Black and deep forest green dominate with luminous emerald and white text accents.",
          "confidence": "HIGH"
        }
      ]
    },
    "typography": {
      "status": "OBSERVED",
      "summary": "A medium-large title crosses the chest; smaller subtitle, date and location information sit below.",
      "facts": [
        {
          "fact_id": "FACT_008",
          "attribute": "typography",
          "observation": "A medium-large title crosses the chest; smaller subtitle, date and location information sit below.",
          "confidence": "HIGH"
        }
      ]
    },
    "environment": {
      "status": "OBSERVED",
      "summary": "The environment is an abstract dark green event-branding field with circular and wave motifs.",
      "facts": [
        {
          "fact_id": "FACT_009",
          "attribute": "environment",
          "observation": "The environment is an abstract dark green event-branding field with circular and wave motifs.",
          "confidence": "HIGH"
        }
      ]
    },
    "foreground": {
      "status": "OBSERVED",
      "summary": "Translucent green wave ribbons cross the lower front portion of the portrait.",
      "facts": [
        {
          "fact_id": "FACT_010",
          "attribute": "foreground",
          "observation": "Translucent green wave ribbons cross the lower front portion of the portrait.",
          "confidence": "HIGH"
        }
      ]
    },
    "effects": {
      "status": "OBSERVED",
      "summary": "Neon arc glow, flowing ribbons, particles and fine contour lines are visible effects.",
      "facts": [
        {
          "fact_id": "FACT_011",
          "attribute": "effects",
          "observation": "Neon arc glow, flowing ribbons, particles and fine contour lines are visible effects.",
          "confidence": "HIGH"
        }
      ]
    },
    "realism_coherence": {
      "status": "OBSERVED",
      "summary": "A photographic portrait is integrated with abstract luminous branding graphics.",
      "facts": [
        {
          "fact_id": "FACT_012",
          "attribute": "realism_coherence",
          "observation": "A photographic portrait is integrated with abstract luminous branding graphics.",
          "confidence": "HIGH"
        }
      ]
    },
    "complexity_density": {
      "status": "OBSERVED",
      "summary": "Moderate density is concentrated along the central axis, leaving dark margins.",
      "facts": [
        {
          "fact_id": "FACT_013",
          "attribute": "complexity_density",
          "observation": "Moderate density is concentrated along the central axis, leaving dark margins.",
          "confidence": "HIGH"
        }
      ]
    },
    "distinctive_design_decisions": {
      "status": "OBSERVED",
      "summary": "A circular neon arc frames the head while layered green waves pass across the torso and title.",
      "facts": [
        {
          "fact_id": "FACT_014",
          "attribute": "distinctive_design_decisions",
          "observation": "A circular neon arc frames the head while layered green waves pass across the torso and title.",
          "confidence": "HIGH"
        }
      ]
    }
  },
  "interpretations": [],
  "uncertainty_notes": [
    "Observation was performed from a neutral compressed visual rendition derived from the indexed image bytes; very small text and fine details may be uncertain."
  ],
  "semantic_boundaries": {
    "human_reason_written": false,
    "general_quality_judgment_performed": false,
    "designer_preference_inferred": false,
    "pairwise_inference_performed": false
  },
  "provenance": {
    "asserted_by": "MULTIMODAL_ANALYZER",
    "recorded_by": "APPROVED_DIRECTION_MEMORY_SERVICE",
    "source_type": "IMAGE_BYTES",
    "source_ref": "my-eyes-image://MYE_IMG_000004@sha256:62ca8e94715864da42ae76067ebbc644f34b4d39f4b510416f6062643d3f9dce",
    "recorded_at": "2026-08-10T05:58:45.868Z",
    "data_classification": "REAL_AI_ANALYSIS"
  }
}
