{
  "schema_version": "1.0.0",
  "analysis_id": "MYE_ANA_000022",
  "image_id": "MYE_IMG_000008",
  "image_sha256": "8786d28b33f97c438b2067a48e973798678fc4e952685cb7f0b9b436434f6497",
  "analysis_version": 2,
  "analyzed_at": "2026-08-10T06:03:16.295Z",
  "blind_analysis": true,
  "label_visible_during_analysis": false,
  "human_decision_context_used": false,
  "data_classification": "REAL_AI_ANALYSIS",
  "analyzer": {
    "provider": "OpenAI",
    "model": "Codex multimodal runtime",
    "analyzer_version": "session-2026-08-10",
    "analysis_prompt_version": "my-eyes-blind-visual-observation-v1"
  },
  "overall_observation_summary": "Landscape hero with a smiling blonde woman on the right and a broad empty purple gradient field on the left.",
  "dimensions": {
    "format_usage": {
      "status": "OBSERVED",
      "summary": "Wide landscape frame reserves most of the left half as open copy space.",
      "facts": [
        {
          "fact_id": "FACT_001",
          "attribute": "format_usage",
          "observation": "Wide landscape frame reserves most of the left half as open copy space.",
          "confidence": "HIGH"
        }
      ]
    },
    "composition": {
      "status": "OBSERVED",
      "summary": "Standing subject is placed right of center against an expansive gradient field.",
      "facts": [
        {
          "fact_id": "FACT_002",
          "attribute": "composition",
          "observation": "Standing subject is placed right of center against an expansive gradient field.",
          "confidence": "HIGH"
        }
      ]
    },
    "visual_hierarchy": {
      "status": "OBSERVED",
      "summary": "The face and white blazer carry attention against the darker purple background.",
      "facts": [
        {
          "fact_id": "FACT_003",
          "attribute": "visual_hierarchy",
          "observation": "The face and white blazer carry attention against the darker purple background.",
          "confidence": "HIGH"
        }
      ]
    },
    "depth": {
      "status": "OBSERVED",
      "summary": "A soft halo, faint distant city texture and subject separation create limited layered depth.",
      "facts": [
        {
          "fact_id": "FACT_004",
          "attribute": "depth",
          "observation": "A soft halo, faint distant city texture and subject separation create limited layered depth.",
          "confidence": "HIGH"
        }
      ]
    },
    "subject_environment_integration": {
      "status": "OBSERVED",
      "summary": "Purple backlight and edge illumination visually connect the subject with the gradient environment.",
      "facts": [
        {
          "fact_id": "FACT_005",
          "attribute": "subject_environment_integration",
          "observation": "Purple backlight and edge illumination visually connect the subject with the gradient environment.",
          "confidence": "HIGH"
        }
      ]
    },
    "lighting": {
      "status": "OBSERVED",
      "summary": "Soft frontal illumination is paired with a purple halo behind the head and shoulders.",
      "facts": [
        {
          "fact_id": "FACT_006",
          "attribute": "lighting",
          "observation": "Soft frontal illumination is paired with a purple halo behind the head and shoulders.",
          "confidence": "HIGH"
        }
      ]
    },
    "color": {
      "status": "OBSERVED",
      "summary": "Purple and violet dominate, with the white blazer creating the principal light value contrast.",
      "facts": [
        {
          "fact_id": "FACT_007",
          "attribute": "color",
          "observation": "Purple and violet dominate, with the white blazer creating the principal light value contrast.",
          "confidence": "HIGH"
        }
      ]
    },
    "typography": {
      "status": "NOT_PRESENT",
      "summary": "No legible typography is present in the observed frame.",
      "facts": []
    },
    "environment": {
      "status": "OBSERVED",
      "summary": "A faint city-like silhouette and sparse star-like points appear behind the gradient.",
      "facts": [
        {
          "fact_id": "FACT_008",
          "attribute": "environment",
          "observation": "A faint city-like silhouette and sparse star-like points appear behind the gradient.",
          "confidence": "HIGH"
        }
      ]
    },
    "foreground": {
      "status": "OBSERVED",
      "summary": "No distinct near-camera object layer is visible; the lower subject crop is the nearest plane.",
      "facts": [
        {
          "fact_id": "FACT_009",
          "attribute": "foreground",
          "observation": "No distinct near-camera object layer is visible; the lower subject crop is the nearest plane.",
          "confidence": "HIGH"
        }
      ]
    },
    "effects": {
      "status": "OBSERVED",
      "summary": "A circular glow and subtle atmospheric points are the main visible effects.",
      "facts": [
        {
          "fact_id": "FACT_010",
          "attribute": "effects",
          "observation": "A circular glow and subtle atmospheric points are the main visible effects.",
          "confidence": "HIGH"
        }
      ]
    },
    "realism_coherence": {
      "status": "OBSERVED",
      "summary": "Photographic human proportions are retained while the backdrop uses a stylized gradient treatment.",
      "facts": [
        {
          "fact_id": "FACT_011",
          "attribute": "realism_coherence",
          "observation": "Photographic human proportions are retained while the backdrop uses a stylized gradient treatment.",
          "confidence": "HIGH"
        }
      ]
    },
    "complexity_density": {
      "status": "OBSERVED",
      "summary": "The frame has low element density, with detail concentrated around the subject on the right.",
      "facts": [
        {
          "fact_id": "FACT_012",
          "attribute": "complexity_density",
          "observation": "The frame has low element density, with detail concentrated around the subject on the right.",
          "confidence": "HIGH"
        }
      ]
    },
    "distinctive_design_decisions": {
      "status": "OBSERVED",
      "summary": "A large unoccupied purple field occupies the side opposite a bright white-clad subject.",
      "facts": [
        {
          "fact_id": "FACT_013",
          "attribute": "distinctive_design_decisions",
          "observation": "A large unoccupied purple field occupies the side opposite a bright white-clad subject.",
          "confidence": "HIGH"
        }
      ]
    }
  },
  "interpretations": [],
  "uncertainty_notes": [
    "Observation was performed from a neutral compressed visual rendition derived from the indexed image bytes; very small text and fine details may be uncertain.",
    "Version 2 removes intent-implying wording from an otherwise unchanged blind observation."
  ],
  "semantic_boundaries": {
    "human_reason_written": false,
    "general_quality_judgment_performed": false,
    "designer_preference_inferred": false,
    "pairwise_inference_performed": false
  },
  "provenance": {
    "asserted_by": "MULTIMODAL_ANALYZER",
    "recorded_by": "APPROVED_DIRECTION_MEMORY_SERVICE",
    "source_type": "IMAGE_BYTES",
    "source_ref": "my-eyes-image://MYE_IMG_000008@sha256:8786d28b33f97c438b2067a48e973798678fc4e952685cb7f0b9b436434f6497",
    "recorded_at": "2026-08-10T06:03:16.295Z",
    "data_classification": "REAL_AI_ANALYSIS"
  }
}
