{
  "schema_version": "1.0.0",
  "analysis_id": "MYE_ANA_000009",
  "image_id": "MYE_IMG_000019",
  "image_sha256": "fd78a948ac123108bad39cf90136eb6c016434dafc09af834560da38cddadb57",
  "analysis_version": 1,
  "analyzed_at": "2026-08-10T05:58:45.868Z",
  "blind_analysis": true,
  "label_visible_during_analysis": false,
  "human_decision_context_used": false,
  "data_classification": "REAL_AI_ANALYSIS",
  "analyzer": {
    "provider": "OpenAI",
    "model": "Codex multimodal runtime",
    "analyzer_version": "session-2026-08-10",
    "analysis_prompt_version": "my-eyes-blind-visual-observation-v1"
  },
  "overall_observation_summary": "Dense surreal portrait poster with a central man holding a colorful cup, large title text and floating classical, mechanical and creative objects.",
  "dimensions": {
    "format_usage": {
      "status": "OBSERVED",
      "summary": "Portrait frame packs title, central figure, held object and lower branding along the vertical axis.",
      "facts": [
        {
          "fact_id": "FACT_001",
          "attribute": "format_usage",
          "observation": "Portrait frame packs title, central figure, held object and lower branding along the vertical axis.",
          "confidence": "HIGH"
        }
      ]
    },
    "composition": {
      "status": "OBSERVED",
      "summary": "The central figure is enclosed by asymmetric columns, clocks, tools and sculptural fragments.",
      "facts": [
        {
          "fact_id": "FACT_002",
          "attribute": "composition",
          "observation": "The central figure is enclosed by asymmetric columns, clocks, tools and sculptural fragments.",
          "confidence": "HIGH"
        }
      ]
    },
    "visual_hierarchy": {
      "status": "OBSERVED",
      "summary": "The top title leads into the face and colorful cup, then the lower title mark.",
      "facts": [
        {
          "fact_id": "FACT_003",
          "attribute": "visual_hierarchy",
          "observation": "The top title leads into the face and colorful cup, then the lower title mark.",
          "confidence": "HIGH"
        }
      ]
    },
    "depth": {
      "status": "OBSERVED",
      "summary": "Near-camera objects, held cup, subject, architectural props and distant teal-gold environment create many planes.",
      "facts": [
        {
          "fact_id": "FACT_004",
          "attribute": "depth",
          "observation": "Near-camera objects, held cup, subject, architectural props and distant teal-gold environment create many planes.",
          "confidence": "HIGH"
        }
      ]
    },
    "subject_environment_integration": {
      "status": "OBSERVED",
      "summary": "Shared teal-gold lighting and overlapping props visually place the subject inside the surreal set.",
      "facts": [
        {
          "fact_id": "FACT_005",
          "attribute": "subject_environment_integration",
          "observation": "Shared teal-gold lighting and overlapping props visually place the subject inside the surreal set.",
          "confidence": "HIGH"
        }
      ]
    },
    "lighting": {
      "status": "OBSERVED",
      "summary": "Warm gold highlights and cool teal ambient light alternate across the objects and figure.",
      "facts": [
        {
          "fact_id": "FACT_006",
          "attribute": "lighting",
          "observation": "Warm gold highlights and cool teal ambient light alternate across the objects and figure.",
          "confidence": "HIGH"
        }
      ]
    },
    "color": {
      "status": "OBSERVED",
      "summary": "Teal, turquoise, bronze and gold dominate with white type and multicolor cup contents.",
      "facts": [
        {
          "fact_id": "FACT_007",
          "attribute": "color",
          "observation": "Teal, turquoise, bronze and gold dominate with white type and multicolor cup contents.",
          "confidence": "HIGH"
        }
      ]
    },
    "typography": {
      "status": "OBSERVED",
      "summary": "A large single-word title appears at the top and a stylized two-word title anchors the lower region.",
      "facts": [
        {
          "fact_id": "FACT_008",
          "attribute": "typography",
          "observation": "A large single-word title appears at the top and a stylized two-word title anchors the lower region.",
          "confidence": "HIGH"
        }
      ]
    },
    "environment": {
      "status": "OBSERVED",
      "summary": "The environment resembles a constructed fantasy studio with classical columns, clocks and sculptural forms.",
      "facts": [
        {
          "fact_id": "FACT_009",
          "attribute": "environment",
          "observation": "The environment resembles a constructed fantasy studio with classical columns, clocks and sculptural forms.",
          "confidence": "HIGH"
        }
      ]
    },
    "foreground": {
      "status": "OBSERVED",
      "summary": "Clocks, a pen-like tool, columns and other objects extend close to the frame edges.",
      "facts": [
        {
          "fact_id": "FACT_010",
          "attribute": "foreground",
          "observation": "Clocks, a pen-like tool, columns and other objects extend close to the frame edges.",
          "confidence": "HIGH"
        }
      ]
    },
    "effects": {
      "status": "OBSERVED",
      "summary": "Floating objects, mist, particles, glow and scale shifts create a surreal composite.",
      "facts": [
        {
          "fact_id": "FACT_011",
          "attribute": "effects",
          "observation": "Floating objects, mist, particles, glow and scale shifts create a surreal composite.",
          "confidence": "HIGH"
        }
      ]
    },
    "realism_coherence": {
      "status": "OBSERVED",
      "summary": "A photographic human is combined with impossible object suspension and theatrical architecture.",
      "facts": [
        {
          "fact_id": "FACT_012",
          "attribute": "realism_coherence",
          "observation": "A photographic human is combined with impossible object suspension and theatrical architecture.",
          "confidence": "HIGH"
        }
      ]
    },
    "complexity_density": {
      "status": "OBSERVED",
      "summary": "Very high density covers nearly the entire frame with repeated overlaps and small details.",
      "facts": [
        {
          "fact_id": "FACT_013",
          "attribute": "complexity_density",
          "observation": "Very high density covers nearly the entire frame with repeated overlaps and small details.",
          "confidence": "HIGH"
        }
      ]
    },
    "distinctive_design_decisions": {
      "status": "OBSERVED",
      "summary": "A cup held at the center releases or contains a cluster of colorful creative elements amid classical props.",
      "facts": [
        {
          "fact_id": "FACT_014",
          "attribute": "distinctive_design_decisions",
          "observation": "A cup held at the center releases or contains a cluster of colorful creative elements amid classical props.",
          "confidence": "HIGH"
        }
      ]
    }
  },
  "interpretations": [],
  "uncertainty_notes": [
    "Observation was performed from a neutral compressed visual rendition derived from the indexed image bytes; very small text and fine details may be uncertain."
  ],
  "semantic_boundaries": {
    "human_reason_written": false,
    "general_quality_judgment_performed": false,
    "designer_preference_inferred": false,
    "pairwise_inference_performed": false
  },
  "provenance": {
    "asserted_by": "MULTIMODAL_ANALYZER",
    "recorded_by": "APPROVED_DIRECTION_MEMORY_SERVICE",
    "source_type": "IMAGE_BYTES",
    "source_ref": "my-eyes-image://MYE_IMG_000019@sha256:fd78a948ac123108bad39cf90136eb6c016434dafc09af834560da38cddadb57",
    "recorded_at": "2026-08-10T05:58:45.868Z",
    "data_classification": "REAL_AI_ANALYSIS"
  }
}
